Category,Website,Article,Author,Article URL,Description,Summary,Published Date,Scraped Date,Image URL,Approve article
Construction,The New York Times,"A.I. Can't Build a High-Rise, but It Can Speed Up the Job",Patrick Sisson,https://news.google.com/rss/articles/CBMiYWh0dHBzOi8vd3d3Lm55dGltZXMuY29tLzIwMjMvMDgvMTUvYnVzaW5lc3MvYXJ0aWZpY2lhbC1pbnRlbGxpZ2VuY2UtY29uc3RydWN0aW9uLXJlYWwtZXN0YXRlLmh0bWzSAQA?oc%3D5&gl=GB&m=0&pc=n&cm=2&hl=en-US&src=1,"Meant as a sly swipe at the inflated hype around artificial intelligence, a billboard at a construction site in Antwerp, Belgium, in June read “Hey Catgut, finish this building.”

Artificial intelligence, the technology that powers chatbots like Catgut, won’t be assembling apartments or erecting stadiums any time soon, but in construction — an industry stereotypically known for clipboards and Excel spreadsheets — the rapid embrace of the technology may change how quickly projects are finished.

Drones, cameras, mobile apps and even some robots are increasingly mapping real-time progress on sprawling job sites, giving builders and contractors the ability to track and improve a project’s performance.

“Forget about robots building a skyscraper,” said James Swanson, chief executive of Voyage Control, which makes project management software for construction sites. “It’s a more fundamental thing, getting the data you need and then using it better.”","A billboard at a construction site in Antwerp read ""Hey Catgut, finish this building"" the rapid embrace of the technology may change how quickly projects are finished. Some robots are mapping real-time progress on sprawling job sites.",15/08/23,21/08/23,,
Construction,The Colorado Sun,Colorado researchers see big potential for AI in agriculture,"Shannon Mullane, More Shannon Mullane, Water Reporter",https://news.google.com/rss/articles/CBMiXGh0dHBzOi8vY29sb3JhZG9zdW4uY29tLzIwMjMvMDgvMjEvY29sb3JhZG8tcmVzZWFyY2hlci10b29sLWZhcm1lcnMtYXJ0aWZpY2lhbC1pbnRlbGxpZ2VuY2Uv0gEA?oc%3D5&gl=GB&m=0&pc=n&cm=2&hl=en-US&src=1,"FRUIT — When Perry Cabot looks at his 12-acre cornfield northeast of Fruit, he sees much more than a flat field among many other flat fields baking under a cloudless sky.

He sees a bountiful reserve of data and a way to fine-tune crop production in the drought-challenged Colorado River Basin using a new tool: artificial intelligence.

“This is the data-mining year. This is the year I’m looking for the nuggets,” said Cabot, an extension professor with Colorado State University, as he walked the field in April.

AI has long been in our cultural dialogue — e.g., robots waking up and taking over the world — and now it’s making its way into our hospitals, classrooms, Hollywood labor strikes and construction sites. Cabot and his research partners think AI has a place in agriculture, where the field of precision agriculture is already harnessing new technologies to boos tag practices.

The researchers are testing out their idea with a million-dollar, multiyear research project funded by the U.S. Department of Agriculture. If things go according to plan, they say their project could lay the foundation within two decades for a long-term shift in how farming is done in the Colorado River Basin.

“The thing I’m most excited about is we’re able to take something that’s extremely complex and then make it useful for farmers,” Cabot said.

What happens on farms and ranches in the Colorado River Basin has big implications for the rest of the basin, where the multibillion-dollar agriculture industry uses at least 75% of the basin’s water supply while growing food for the nation.

The basin provides water to millions of people. But its supply is dwindling, and water users are struggling to curb overuse in face of prolonged drought and climate change.

More efficient water technology would change how farmers operate their businesses, Cabot said. He emphasized that efficiency doesn’t mean conservation: Farmers could use their water savings to grow more crops, and support their livelihoods, instead of cutting down on water use entirely.

“I don’t like the word ‘minimize’ water. I hate that term. It’s optimizing,” Cabot said. “We’re trying to learn what nuggets of information exist to allow us to make decisions to optimize the water resources that we have.”

Rows of the crop fields at the Colorado State University’s Fruit Research Station, June 5, 2023, in Mesa County. (Hugh Carey, The Colorado Sun)

21st century irrigation

Optimizing resources on farms has a lot to do with weather, elevation changes, soil conditions, expensive equipment and irrigation systems.

A typical corn yield is about 200 bushels per acre, Cabot said. But a 10-acre field sees a ton of variety: Some acres produce 250 bushels, while others might only grow 150 bushels.

“If we’re applying the same amount of fertilizer and theoretically the same amount of water, then why are we not getting the same yield?” he said.

If a farmer puts 1 inch of water on an entire field, plants will have varying success because of the changing conditions in different sections. Water might run off higher areas of the field and gather in lower areas. Different soils have different absorption rates: Clay soils hold more water but absorb it more slowly, whereas water runs more quickly through sandy soils, Cabot said.

An irrigation system, on June 5, 2023, is monitored and controlled by the AI computer programming to move the water sprinklers at the Colorado State University’s Fruit Research Station crop fields on its own. The AI can monitor and analyze the soil moisture, crop’s growth progress, and then open the water valves when it is needed. (Hugh Carey, The Colorado Sun)

“We’re not following the trend in the natural environment. We’re not doing what the natural environment wants us to do,” he said.

But with modern technological improvements, farmers can design irrigation programs to apply varying amounts of water across their fields.

These varying rate sprinkler systems are about 80% efficient and are often programmed based on historical observations. Flood (furrow) irrigation systems, when farmers flow water down trenches running through their crops, are about 30% efficient, Cabot said.

But if farmers could adjust their irrigation practices according to a data-filled map of their cropland — or if an AI algorithm could do it for them — the whole process could improve. And that’s what Cabot and his research partners are trying to do.

Mining data

At the CSU research station near Fruit, Cabot’s project is on schedule. They started collecting data this year after completing construction last year.

This is where Cabot’s nuggets come into play.

Cabot and his team took the seemingly flat 12-acre field and broke it into 15-by-40-foot zones, like a giant chessboard, he said. They’re harvesting every bit of data they can find: nitrogen levels, electrical conductivity, nutrient holding capacity, texture, water holding capacity and organic matter.

The team spent the spring and summer walking the field to gather measurements manually. They pulled data from satellite imagery, digital elevation models and spatial weather grids. “Salt sniffers,” devices that shoot electrical signals into the ground, measured the soil’s salt content in each zone.

In late spring, a system of pipes and ditches began delivering Colorado River water to the farm.

On a computer, Cabot’s team adjusted numbers on a spreadsheet tool to assign the amount of water for each zone. As the sprinkler system rolled over, hanging nozzles automatically changed how much water was released.

As the corn grew, the researchers monitored its growth stages, measuring plant leaf canopies and how quickly kernels appeared. Drones flying above the field mapped the vegetative index to determine how green plants are as an indicator of their health.

Similar study sites are set up elsewhere in the Colorado River Basin and Salinas River Valley in California. Researchers from the University of California Riverside, University of Arizona, Duke University and more are contributing their expertise and hope to wrap up the project in 2025.

The goal at this stage, Cabot said, is to figure out which variables impact crop yields the most. Next year, they’ll start feeding that data to AI algorithms to see if they can start getting better crops with less water and 10%-12% profit margins.

“We would never expect farmers to gather the resolution, the magnitude, the variety of data that we are gathering,” he said. “Our job is to grab everything and then grind it down.”

Colorado State University water resources specialist Perry Cabot, left, and Adam Booster move the irrigation hose on the crop fields on the Colorado State University’s Fruit Research Station, June 5, 2023, in Fruit. The research station allows researchers to experiment with irrigation and harvesting techniques using the high desert climate near the Utah border. (Hugh Carey, The Colorado Sun)

Could it work?

The farmers Cabot has talked to about the project aren’t really sure what to expect, he said.

“When was the last time anyone in the United States really liked anything with the word ‘artificial’ in front of it?” he said.

Even if the researchers can irrigate with more than 80% efficiency and keep profits at around 10%-12%, they’ll still face a critical challenge: making the technology easily accessible to agricultural producers.

Farmers would have to learn how to use the technology — one more task on already long to-do lists. The researchers plan to develop training programs and user-friendly web interfaces, including a smartphone app, to help ease the transition.

The program would also need to play well with the massively expensive equipment already being used on farms. Cabot’s research uses a Range Irrigation linear move system, the only variable-rate system of its kind in western Colorado, he said.

“The first 7 feet of this thing costs $30,000,” he said. The linear move itself cost about a quarter-million dollars, and the researchers might still install more improvements to their irrigation system to reduce water lost to wind.

The system also might be most effective on larger operations, like farms of 40 acres or more, Cabot said.

Colorado’s largest operation, the Ute Mountain Ute Farm and Ranch in southwestern Colorado, is 7,600 acres. Simon Martinez, the general manager, was interested in learning more about Cabot’s research, hoping to farm more with less water, he said.

“I would want to look at it,” Martinez said. “I’m all for changing direction, but is that direction feasible for the long term?”

The Farm and Ranch is a multimillion-dollar operation that is already using many of the latest agricultural practices. Its staff is using variable-rate sprinkler systems, doing soil sampling and experimenting with more water-efficient crops. They even draw from hydropower and are considering incorporating solar technology.

Cabot said if the farm already uses variable rate irrigation, then his research would be able to help them operate based on up-to-date, changing conditions — like the health of plants in a particular zone at the time of irrigation.

“They’d be more nimble, they’d be more flexible, they’d be more real-time,” he said.","Researchers are testing out their idea with a million-dollar, multiyear research project funded by the U.S. Department of Agriculture. The project could lay the foundation within two decades for a long-term shift in how farming is done in the Colorado River Basin.",21/08/23,21/08/23,,
Construction,Microsoft,Microsoft AI Red Team building future of safer AI,Ram Shankar Siva Kumar,https://news.google.com/rss/articles/CBMia2h0dHBzOi8vd3d3Lm1pY3Jvc29mdC5jb20vZW4tdXMvc2VjdXJpdHkvYmxvZy8yMDIzLzA4LzA3L21pY3Jvc29mdC1haS1yZWQtdGVhbS1idWlsZGluZy1mdXR1cmUtb2Ytc2FmZXItYWkv0gEA?oc%3D5&gl=GB&m=0&pc=n&cm=2&hl=en-US&src=1,"An essential part of shipping software securely is red teaming. It broadly refers to the practice of emulating real-world adversaries and their tools, tactics, and procedures to identify risks, uncover blind spots, validate assumptions, and improve the overall security posture of systems. Microsoft has a rich history of red teaming emerging technology with a goal of proactively identifying failures in the technology. As AI systems became more prevalent, in 2018, Microsoft established the AI Red Team: a group of interdisciplinary experts dedicated to thinking like attackers and probing AI systems for failures.

We’re sharing best practices from our team, so others can benefit from Microsoft’s learnings. These best practices can help security teams proactively hunt for failures in AI systems, define a defense-in-depth approach, and create a plan to evolve and grow your security posture as generative AI systems evolve.

The practice of AI red teaming has evolved to take on a more expanded meaning: it not only covers probing for security vulnerabilities, but also includes probing for other system failures, such as the generation of potentially harmful content. AI systems come with new risks, and red teaming is core to understanding those novel risks, such as prompt injection and producing ungrounded content. AI red teaming is not just a nice to have at Microsoft; it is a cornerstone to responsible AI by design: as Microsoft President and Vice Chair, Brad Smith, announced, Microsoft recently committed that all high-risk AI systems will go through independent red teaming before deployment.

The goal of this blog is to contextualize for security professionals how AI red teaming intersects with traditional red teaming, and where it differs. This, we hope, will empower more organizations to red team their own AI systems as well as provide insights into leveraging their existing traditional red teams and AI teams better.

Red teaming helps make AI implementation safer

Over the last several years, Microsoft’s AI Red Team has continuously created and shared content to empower security professionals to think comprehensively and proactively about how to implement AI securely. In October 2020, Microsoft collaborated with MITE as well as industry and academic partners to develop and release the Adversarial Machine Learning Threat Matrix, a framework for empowering security analysts to detect, respond, and remediate threats. Also in 2020, we created and open sourced Microsoft Counterfeit, an automation tool for security testing AI systems to help the whole industry improve the security of AI solutions. Following that, we released the AI security risk assessment framework in 2021 to help organizations mature their security practices around the security of AI systems, in addition to updating Counterfeit. Earlier this year, we announced additional collaborations with key partners to help organizations understand the risks associated with AI systems so that organizations can use them safely, including the integration of Counterfeit into MITE tooling, and collaborations with Hugging Face on an AI-specific security scanner that is available on GitHub.

Security-related AI red teaming is part of a larger responsible AI (RAI) red teaming effort that focuses on Microsoft’s AI principles of fairness, reliability and safety, privacy and security, inclusiveness, transparency, and accountability. The collective work has had a direct impact on the way we ship AI products to our customers. For instance, before the new Bing chat experience was released, a team of dozens of security and responsible AI experts across the company spent hundreds of hours probing for novel security and responsible AI risks. This was in addition to the regular, intensive software security practices followed by the team, as well as red teaming the base GPT-4 model by RAI experts in advance of developing Bing Chat. Our red teaming findings informed the systematic measurement of these risks and built scoped mitigations before the product shipped.

Guidance and resources for red teaming

AI red teaming generally takes place at two levels: at the base model level (e.g., GPT-4) or at the application level (e.g., Security Copilot, which uses GPT-4 in the back end). Both levels bring their own advantages: for instance, red teaming the model helps to identify early in the process how models can be misused, to scope capabilities of the model, and to understand the model’s limitations. These insights can be fed into the model development process to improve future model versions but also get a jump-start on which applications it is most suited for. Application-level AI red teaming takes a system view, of which the base model is one part. For instance, when AI red teaming Bing Chat, the entire search experience powered by GPT-4 was in scope and was probed for failures. This helps to identify failures beyond just the model-level safety mechanisms, by including the overall application specific safety triggers.

Together, probing for both security and responsible AI risks provides a single snapshot of how threats and even benign usage of the system can compromise the integrity, confidentiality, availability, and accountability of AI systems. This combined view of security and responsible AI provides valuable insights not just in proactively identifying issues, but also to understand their prevalence in the system through measurement and inform strategies for mitigation. Below are key learnings that have helped shape Microsoft’s AI Red Team program.

AI red teaming is more expansive. AI red teaming is now an umbrella term for probing both security and RAI outcomes.  red teaming intersects with traditional red teaming goals in that the security component focuses on model as a vector. So, some goals may include, for instance, to steal the underlying model. But AI systems also inherit new security vulnerabilities, such as prompt injection and poisoning, which need special attention. In addition to the security goals, AI red teaming also includes probing for outcomes such as fairness issues (e.g., stereotyping) and harmful content (e.g., glorification of violence). AI red teaming helps identify these issues early, so we can prioritize our defense investments appropriately. AI red teaming focuses on failures from both malicious and benign personas. Take the case of red teaming new Bing. In the new Bing, AI red teaming not only focused on how a malicious adversary can subvert the AI system via security-focused techniques and exploits, but also on how the system can generate problematic and harmful content when regular users interact with the system. So, unlike traditional security red teaming, which mostly focuses on only malicious adversaries, AI red teaming considers broader set of personas and failures. AI systems are constantly evolving. AI applications routinely change. For instance, in the case of a large language model application, developers may change the  (underlying instructions to the ML model) based on feedback. While traditional software systems also change, in our experience, AI systems change at a faster rate. Thus, it is important to pursue multiple rounds of red teaming of AI systems and to establish systematic, automated measurement and monitor systems over time. Red teaming generative AI systems requires multiple attempts. In a traditional red teaming engagement, using a tool or technique at two different time points on the same input, would always produce the same output. In other words, generally, traditional red teaming is deterministic. Generative AI systems, on the other hand, are probabilistic. This means that running the same input twice may provide different outputs. This is by design because the probabilistic nature of generative AI allows for a wider range in creative output.  also makes it tricky to red teaming since a prompt may not lead to failure in the first attempt, but be successful (in surfacing security threats or RAI harms) in the succeeding attempt. One way we have accounted for this is, as Brad Smith mentioned in his blog, to pursue multiple rounds of red teaming in the same operation. Microsoft has also invested in automation that helps to scale our operations and a systemic measurement strategy that quantifies the extent of the risk. Mitigating AI failures requires defense in depth. Just like in traditional security where a problem like phishing requires a variety of technical mitigations such as hardening the host to smartly identifying malicious URIs, fixing failures found via AI red teaming requires a defense-in-depth approach, too. This involves the use of classifiers to flag potentially harmful content to using  to guide behavior to limiting conversational drift in conversational scenarios.

Building technology responsibly and securely is in Microsoft’s DNA. Last year, Microsoft celebrated the 20-year anniversary of the Trustworthy Computing memo that asked Microsoft to deliver products “as available, reliable and secure as standard services such as electricity, water services, and telephony.” AI is shaping up to be the most transformational technology of the 21st century. And like any new technology, AI is subject to novel threats. Earning customer trust by safeguarding our products remains a guiding principle as we enter this new era – and the AI Red Team is front and center of this effort. We hope this blog post inspires others to responsibly and safely integrate AI via red teaming.

Resources

AI red teaming is part of the broader Microsoft strategy to deliver AI systems securely and responsibly. Here are some other resources to provide insights into this process:

Contributions from Steph Ballard, Borough , Amanda Finnish, Gary Lopez Munoz, and Chang Yamaguchi.","The practice of red teaming has evolved to take on a more expanded meaning: it covers probing for security vulnerabilities, but also includes probing for other system failures. The practice of red teaming has evolved to take on a more expanded meaning: it covers probing for security vulnerabilities.",07/08/23,21/08/23,,
