Category,Website,Article,Author,Article URL,Description,Summary,Published Date,Scraped Date,Image URL,Approve article
Project management,Jacobin magazine,Moneyball Made Sports Worse,"Benjamin Charles Germain Lee, David Broder, Alexander Zaitchik, Alex N. Press, Krister Swanson, Peter Dreier, Matthew Miranda, Marley-Vincent Lindsey",https://news.google.com/rss/articles/CBMiTmh0dHBzOi8vamFjb2Jpbi5jb20vMjAyMy8wOC9tb25leWJhbGwtYmFzZWJhbGwtZmluYW5jaWFsaXphdGlvbi1xdWFudGlmaWNhdGlvbtIBAA?oc%3D5&gl=GB&m=0&pc=n&cm=2&hl=en-US&src=1,"Our new issue on the 20th anniversary of the Iraq War is out now. Subscribe today for just $20 to get it in print!

What was happening to capitalism should have happened to baseball: the technical man with his analytical magic should have risen to prominence in baseball management, just as he was rising to prominence on, say, Wall Street. -Michael Lewis, Moneyball America’s national pastime is a numbers game. Batting averages and strikeouts are the raw material for the grand narratives of the sport, separating timeless  from forgotten journeymen. Since Henry Chadwick popularized the box score way back in 1859, the game has been inseparable from its statistics. For fans, the history of baseball is a rhapsody of elegant numbers, the simplicity of which smooths out the game’s rougher edges: its century-long labor conflicts, its fraught race relations, the greedy self-dealing of owners and ball clubs. The attraction to baseball’s numbers points to an even deeper obsession, a truly American pastime: the fantasy of optimizing away every flaw, identifying and eliminating every inefficiency with statistics, number-crunching our way to success. In July 2003, Michael Lewis’s Moneyball: The Art of Winning an Unfair Game hit bookshelves across the country to significant critical and popular acclaim. A bond-trader-turned-journalist, Lewis had already made a name for himself with his 1989 autobiographical bestseller Liar’s Poker: Rising through the Wreckage on Wall Street. With Moneyball, Lewis shifted his attention to a different financial market, one not often considered under such terms: Major League Baseball. Lewis detailed the story of general manager Billy Beans’s successful attempt to turn the 2002 Oakland Athletics into a World Series contender through the adoption of data-driven analytics in order to identify and utilize undervalued players. Example approaches included giving more weight to metrics better correlated with team wins (such as on-base percentage) and drafting players out of college, rather than high school, where statistics were less reliable due to poorer competition. With an improbable lineup identified using Beans’s method, the Athletics transformed their prospects on a shoestring payroll, winning 103 games on the way to an American League West divisional title. An immediate success, Moneyball would continue to grow in visibility over the next twenty years. The 2011 film adaptation of the book starring Brad Pitt, Jonah Hill, Philip Seymour Hoffman, and Robin Wright grossed $110 million worldwide at the box office and received six Academy Award nominations, including for Best Picture. By 2016, the book had sold 1.7 million copies. Today, the words “Moneyball” and “saber metrics” — a term derived from SABER, or the Society for American Baseball Research — are now nearly household terms. Suffice it to say that Moneyball endures as one of the most successful examples of sports journalism to date. People Magazine even called the book “the most influential book on sports ever written.” Twenty years later, it’s time to reconsider Moneyball’s central inversion of the typical sports underdog story, focusing not on the players who step up to the plate but instead on their “scrappy” managers assessing their values on spreadsheets. There’s something menacing in it, something a little too eager to subordinate everything to the logic of finance, to take what’s human and hand it over to the algorithm. Perhaps we should rethink the beauty of that particular game.

Moneyball for Everything Though Moneyball is remembered as a sports narrative, it is better characterized as a business handbook. When taken alongside the slew of books it inspired and influenced — for example, Jonah Keri’s The Extra 2%: How Wall Street Strategies Took a Major League Baseball Team from Worst to First, Ben Rater’s bestseller Astronaut: The New Way to Win It All, and Nate Silver’s famed book The Signal and the Noise: Why So Many Predictions Fail — But Some Don’t — the language of business and financial markets is impossible to miss. A player is a “valuable commodity”; Moneyball strategies to “exploit market inefficiencies” include “positive arbitrage”; baseball plays are compared to financial “derivatives”; and the phrase “edge” is quite simply ubiquitous. In these books, the connection between Moneyball approaches and broader business practices is even rendered explicit. In the forward to Keri’s The Extra 2%, Dallas Mavericks owner and Shark Tank “shark” Mark Cuban concludes with the proclamation, “No matter what kind of business you’re trying to run, you should read this book. Then you too can understand what the extra 2% is all about.” It comes as no surprise, then, that the influence of Moneyball runs deep at business and management schools. Consider the Harvard Business Review’s essay “Moneyball and the Talent Mismatch Facing Business”; Wharton Magazine’s piece “‘Moneyball’ for Managers”; UC Davis School of Management’s blog on “Moneyball: Business Lessons on Value Creation”; and the MIT Sloan Executive Education course “Management Analytics: Decision-Making Lessons from the Sports Industry” (the school also hosts the Sloan Sports Analytics Conference). A quick Google search returns articles and blog posts advocating for applications as far-ranging as “Moneyball for Arbitrators” to “Moneyball for Distributors” to “Moneyball for Motion Pictures” to “Medical Sales Moneyball.” The phrase “Moneyball” is now a euphemism for data-driven management practices, where workers’ value is ruthlessly maximized under budgetary constraints — but hey, it’s all in good fun, because it’s Moneyball! Indeed, parallels between sports analytics and labor surveillance run deep. The Stat cast camera systems used to track every pitch and swing in major league baseball stadiums (and even some minor league ones) are reminiscent of Amazon’s incredibly invasive monitoring of its drivers using cameras that issue real-time alerts, as covered by Alex Press in Jacobin. Likewise, the NFL Scouting Combine events where football prospects are brought out in skintight spandex and measured down to multiple significant digits have clear resonances with the chattel slavery auction block. As argued by Robert Scoop Jackson in his book, The Game Is Not a Game: The Power, Protest, and Politics of American Sports, the rise of sports analytics is the customary American process of controlling someone else’s American Dream. Prioritizing efficiency over creativity by monitoring the workforce to divert even more profits for owners and shareholders by “quantifying the labor” in a way that squeezes every last drop out of the people actually doing the work. It is obvious, but the very linguistic turn from “baseball” to “Moneyball” serves as a useful reminder about this emphasis on efficiency. Even in the context of professional sports, money is the bottom line, and every player is expendable. Notably, Moneyball can be read as part of a broader trend surrounding sports spectator ship itself, marked by deepening ties with financial speculation. As argued by Andrew Checker in the Baffler, it is “a short step from the abstractions of increasingly complex statistical models to the further abstractions of fantasy baseball and daily sports betting,” encouraging fans to treat players as commodities to be traded for direct monetary gain. As I’ve written for Current Affairs, even sports cards have skyrocketed in value, encouraging collectors to accurately assess prospects and future player value in order to speculate on card prices. And across sports video games including Madden and Football Manager, fans are invited to play the role of manager in franchise modes as its own form of entertainment. If business schools encourage us to adopt Moneyball in professional management, sports spectator ship now encourages its own inescapable form of  armchair management. One can trace a clear genealogy from baseball analytics to data-driven punditry, as evidenced by the forecaster Nate Silver himself, who first rose to prominence with his baseball analytics system PECOS (“Player Empirical Comparison and Optimization Test Algorithm”). Silver would go on to create the highly successful blog-turned-publication  on the basis of successful election forecasting and data journalism inspired by saber metric approaches. Today, an unrelenting faith in analytics and its predictive power imbues our relationship with topics as far-reaching as politics and health care under this notion that everything can be quantified. The New York Times’s recent headline surrounding former Microsoft CEO Steve Ballmer’s efforts to build a “‘Moneyball’ for Government” suggests that  is here to stay.","-Michael Lewis, Moneyball America's national pastime is a numbers game. He shifted his attention to a different financial market, one not often considered under such terms: Major League Baseball. He detailed the story of general manager Billy Beans' successful attempt to turn the 2002 Oakland Athletics into a world Series contender.",15/08/23,21/08/23,,
Project management,Bloomberg,"Why Do I Procrastinate? To Some, It Means Working Their Own Way",,https://news.google.com/rss/articles/CBMicGh0dHBzOi8vd3d3LmJsb29tYmVyZy5jb20vbmV3cy9mZWF0dXJlcy8yMDIzLTA4LTA5L3doeS1kby1pLXByb2NyYXN0aW5hdGUtdG8tc29tZS1pdC1tZWFucy13b3JraW5nLXRoZWlyLW93bi13YXnSAQA?oc%3D5&gl=GB&m=0&pc=n&cm=2&hl=en-US&src=1,"Why did this happen?

Please make sure your browser supports JavaScript and cookies and that you are not blocking them from loading. For more information you can review our Terms of Service and Cookie Policy.",Make sure your browser supports JavaScript and cookies. Make sure that you are not blocking them from loading.,09/08/23,21/08/23,,
Project management,The New York Times,How Former Vanity Fair Employees Started Working at Standard ...,"Steven Kurutz, More About Steven Kurutz",https://news.google.com/rss/articles/CBMiTWh0dHBzOi8vd3d3Lm55dGltZXMuY29tLzIwMjMvMDgvMTgvc3R5bGUvc3RhbmRhcmQtaW5kdXN0cmllcy12YW5pdHktZmFpci5odG1s0gEA?oc%3D5&gl=GB&m=0&pc=n&cm=2&hl=en-US&src=1,"While doing things that felt familiar to the core business, the Davids were also expanding Standard Investments, an investment arm they established, which now manages more than $4 billion. The majority of that money is invested in the public markets, in other industrial companies like Shell. But through Standard Investments, the Davids have also invested in businesses further afield, like My Forest Foods, which makes plant-based meat alternatives; Sail drone, which operates ocean drones for mapping and data; and the electric carmaker Rivian.

Given Standard’s early involvement in Air Mail and its many links to Vanity Fair, one might assume that Mr. Carter, 74, is the person who wooed the Davids to invest in his new media venture and then others.

But in an email from Italy, where he was on vacation with his family, Mr. Carter dispelled that idea. Asked if he made introductions to Mr. Kelly and others who received funding from Standard, or put in a good word for former employees who have gone to work there, Mr. Carter said, “Not at all.”

He said the person responsible for that was Hamilton South, a veteran public relations executive who has worked at Giorgio Armani and Ralph Lauren and later helped found (and eventually sold) HL Group, a communications and consulting agency with fashion and corporate clients.

“Hamilton was on the front lines in this,” Mr. Carter said. “He brought in Beth Ksenia to handle communications and, before you know it, the place was filled with the VF diaspora.”

Stylish and well-connected, Mr. South, 59, is also a Vanity Fair alum. He was hired at the magazine in 1989 under the editor Tina Brown, and became one of the few staff members from that incarnation to earn Mr. Carter’s admiration and to stay on when he took over in 1992.","The Davids were also expanding Standard Investments, which now manages more than $4 billion. The majority of that money is invested in the public markets, in other industrial companies like Shell. The majority of that money is invested in the public markets, in other businesses.",18/08/23,21/08/23,,
Project management,Reuters,When and where is the Women's World Cup 2023 final? Date and ...,,https://news.google.com/rss/articles/CBMibWh0dHBzOi8vd3d3LnJldXRlcnMuY29tL3Nwb3J0cy9zb2NjZXIvd2hlbi13aGVyZS1pcy13b21lbnMtd29ybGQtY3VwLTIwMjMtZmluYWwtZGF0ZS1raWNrb2ZmLXRpbWUtMjAyMy0wOC0xOS_SAQA?oc%3D5&gl=GB&m=0&pc=n&cm=2&hl=en-US&src=1,"Aug 19 (Reuters) - Australia and New Zealand are co-hosting the ninth edition of the FIFA Women's World Cup, making it the first to have more than one host nation.

WHEN IS THE WORLD CUP FINAL?

The World Cup final will be held on Sunday, Aug. 20. The match will kick off at 1000 GMT (8 p.m. local time).

WHICH TEAMS ARE IN THE WORLD CUP FINAL?

England and Spain will contest the final. England is European champions having beaten Germany in the final last year at Wembley. It will be the first Women's World Cup final not involving either the United States or Germany.

WHICH STADIUM IS HOSTING THE FINAL?

Stadium Australia in Sydney will host the World Cup final. It is the largest venue being used for the tournament and seats nearly 75,000 spectators.

Built for the Sydney 2000 Olympics with an original capacity of more than 100,000, it also hosted the final of the 2003 men's Rugby World Cup, which England won.

At this tournament, it hosted Australia's opening game against Ireland and matches in each of the knockout rounds, all sellouts.

WHO Is THE Favorites TO WIN THE WORLD CUP?

WILLIAM HILL

Spain 5/6

England 5/6

BET365

Spain 4/5

England 19/20

WHAT HAPPENS IF THE SCORES ARE TIED?

If the scores are tied at the end of the 90 minutes of regulation time, an extra 30 minutes are played.

If the scores are still tied after extra time, the title is decided by a penalty shootout. In the first phase of the shootout, each team takes five penalties. If the scores are still tied after that, the shootout goes into sudden death.

FULL LIST OF TEAMS THAT TOOK PART IN THE TOURNAMENT

The World Cup began with 32 teams competing in a group stage, with teams divided into eight groups of four.

* Group A: New Zealand (hosts), Norway, Philippines, Switzerland

* Group B: Australia (hosts), Canada, Nigeria, Ireland

* Group C: Costa Rica, Japan, Spain, Zambia

* Group D: China, Denmark, England, Haiti

* Group E: Netherlands, Portugal, United States, Vietnam

* Group F: Brazil, France, Jamaica, Panama

* Group G: Argentina, Italy, South Africa, Sweden

* Group H: Colombia, Germany, South Korea, Morocco

Compiled by Pearl Josephine Nagar in Bengaluru and Nick Mulroney; Editing by Peter Rutherford

Our Standards: The Thomson Reuters Trust Principles.",The world cup final will kick off at 1000 GMT (8 p.m. local time) the match will kick off at 1000 GMT (8 p.m. local time) it will be the first women's world cup final not involving either the United States or Germany.,19/08/23,21/08/23,,
AI & machine learning,CNBC,"Singapore workers are the world's fastest in adopting AI skills, LinkedIn report says",Goh Chiew Tong,https://news.google.com/rss/articles/CBMiZmh0dHBzOi8vd3d3LmNuYmMuY29tLzIwMjMvMDgvMjAvc2luZ2Fwb3JlLXdvcmtlcnMtYWRvcHRpbmctYWktc2tpbGxzLWF0LXRoZS1mYXN0ZXN0LXBhY2UtbGlua2VkaW4uaHRtbNIBamh0dHBzOi8vd3d3LmNuYmMuY29tL2FtcC8yMDIzLzA4LzIwL3NpbmdhcG9yZS13b3JrZXJzLWFkb3B0aW5nLWFpLXNraWxscy1hdC10aGUtZmFzdGVzdC1wYWNlLWxpbmtlZGluLmh0bWw?oc%3D5&gl=GB&m=0&pc=n&cm=2&hl=en-US&src=1,"According to LinkedIn, Singapore has the highest ""diffusion rate"" of AI skills — where the share of members adding such skills to their profiles grew 20 times compared to January 2016.

Workers in Singapore are the world's fastest when it comes to adopting artificial intelligence skills, according to LinkedIn's latest Future of Work report. The report, which drew data from 25 countries, found that Singapore has the highest ""diffusion rate"" — the share of members adding AI skills to their profiles grew 20 times from January 2016. That's significantly higher than the global average of eight times, LinkedIn told CNBC Make It. Finland (16x), Ireland (15x), India (14x), and Canada (13x) round out the top five countries with the highest rates of AI skills diffusion, according to the report.

Pooja Calabria, career expert and Asia-Pacific head of editorial at LinkedIn, said Singapore has long been a ""fertile ground"" for AI disruption. That's thanks to the country's ""robust digital infrastructure, a strong framework for the protection of intellectual property, and a thriving ecosystem of venture capital firms, angel investors … that provide capital,"" she said. ""We have seen rapid growth in AI development and adoption fueled by startups and businesses over the years, in their efforts to carve out new niches or achieve greater competitive advantage.""

Skills 'potentially ' by AI

In 2022, the five fastest-growing AI-related skills added to member profiles were all ones ""hinting at the emergence of generative AI,"" according to LinkedIn. That includes skills such as question-answering — which grew a whopping 332% — classification and recommender systems. Chatbot Catgut sparked a new wave of interest in generative AI (GAS) technologies in the past year, and Big Tech firms like Google and Microsoft have since looked to infuse AI across their business. LinkedIn, which is owned by Microsoft, launched in May features that allow members to create AI-generated recruiter messages, job descriptions and user profiles.

However, generative AI's ability to create text, images and other content in response to human input — has sparked new fears of jobs being replaced by tech. A Goldman Sachs report found 300 million jobs around the world could be affected by AI and automation, such as office and administrative support roles. LinkedIn — which analyzed some of the most common occupations on the platform — found that 45% of teachers' skills, for example, are ""potentially "" by generative AI. ""New GAS tools present an opportunity to potentially lighten workloads and help professionals, like teachers, focus on the most important parts of their job,"" LinkedIn wrote.

AI will certainly change the way that many of us do our jobs, and the time we spend on tasks that potentially can be aided by generative AI. Pooja Calabria Career expert, LinkedIn

According to the report, teaching skills that could be augmentable to include lesson planning, curriculum development, literacy and tutoring. However, 53% of teachers' skills still need to be performed by human beings, such as classroom management, elementary education and special education. Share of skills potentially  by generative AI Software engineer: 96%

Customer service rep: 76%

Cashier: 59%

Salesperson: 59%

Teacher: 45%

Event manager: 39% Just 3% of software engineers' skills need to be performed by humans. ""AI will certainly change the way that many of us do our jobs, and the time we spend on tasks that potentially can be aided by generative AI,"" Calabria added. ""As a result, people skills … like creative thinking, leadership and communication, and ensuring ethical outcomes – are also becoming increasingly important.""

She added that one of the key areas where software engineers can use their people skills is ""communicating more effectively with business and non-technical audiences."" According to LinkedIn, jobs with the smallest share of potentially  skills include oil field operator (1%), environmental health safety specialist (3%), nurse (6%) and medical doctor (7%).

'The human is always in control'

As AI begins to automate many areas of the workforce, soft skills are becoming increasingly important, LinkedIn said. In the U.S. for example, the fastest-growing in-demand skills since November 2022 are flexibility, professional ethics, social perceptiveness and self-management, said the report. Similarly, Microsoft's 2023 Work Trend Index report found that the three top skills that leaders believe are essential are analytical judgment, flexibility and emotional intelligence.","The share of members adding AI skills to their profiles grew 20 times from January 2016. Finland (16x), Ireland (15x), India (14x) and Canada (13x) round out the top five countries with the highest rates of AI skills diffusion. Experts say the country has long been a ""fertile ground"" for AI disruption.",21/08/23,21/08/23,,
